{
  "$schema": "http://json-schema.org/draft-07/schema#",
  "title": "PDF Vaccine Names Only Schema",
  "description": "Mapping between PDF filenames and vaccine names",
  "type": "array",
  "items": {
    "type": "object",
    "properties": {
      "filename": {"type": "string", "description": "PDF filename"},
      "vax_type": {"type": "string", "description": "CDC vaccine type abbreviation"},
      "vax_name": {"type": "string", "description": "Full vaccine name in VAERS format"},
      "vax_manu": {"type": "string", "description": "Manufacturer name"}
    },
    "required": ["filename", "vax_type", "vax_name", "vax_manu"]
  }
}